scheme_name,detected_themes
Government Institutions for Teaching and Training of Persons with Disabilities,['Education & Learning']
Government Service Home - Tamil Nadu,['Education & Learning']
Government Special School for the Visually Handicapped and the Hearing Impaired,['Education & Learning']
Government of Goa State Scholarship to NDA Cadets,['Education & Learning']
Grama Jyothi,['Education & Learning']
Grant For Organizing Conference,['Education & Learning']
Grant Of Retention Scholarship to Scheduled Caste Girl Students,['Education & Learning']
Grant for Incubation Centers within Educational Institutes Scheme,['Education & Learning']
"Grant of Annual Scholarship to the Students Belonging to UT of Puducherry Selected and Studying in the Sainik School, Amaravathi Nagar, Tamil Nadu",['Education & Learning']
Grant of Financial Assistance for Purchase of Textbooks/Notebooks to School-Going Children of Industrial Workers/Employees (GLWB),['Education & Learning']
Grant of Financial Assistance to the Poor Parents Having Only One Girl Child Who is Studying 8th to 10th Standard,['Education & Learning']
Grant of Financial Assistance to the School Going Children of Industrial Workers/Employees Studying in 1st to 4th Standard for Supply of One Set of Uniform,['Education & Learning']
Grant of Quality Certification Reimbursement of Charges,['Business & Entrepreneurship']
Grant of Stipend to Differently Abled Trainees,['Skills & Employment']
Grant of Stipend to the Differently Abled Trainees of the Vocational Training Institutes,['Skills & Employment']
Grant of Stipends to the Physically Handicapped Students,['Education & Learning']
Grant of Transport Allowance to Differently Abled Persons,['Education & Learning']
Grant on Passing the Written Examination of Competitive Examinations for Recruitment in Armed Forces,['Education & Learning']
Grant to Jharkhand State Unaided Educational Institutions,['Education & Learning']
Grant to Meritorious Wards of ESM in Sports: National / International Level (Sainik Welfare),['Education & Learning']
Grant to Meritorious Wards of Ex-Servicemen in Academics (Lump Sum Grant),['Education & Learning']
Grant-In-Aid to Voluntary Organizations Working In The Area of ​​Disabled Welfare,['Education & Learning']
Grant-in-Aid Scheme To Provide Financial Assistance To The Mahila Mandals/ Women’s Self-help Groups (SWAWLAMBHAN),['Skills & Employment']
Grant-in-Aid Scheme to Provide Financial Assistance to the Mahila Mandals,['Skills & Employment']
"Grant-in-Aid to Non-governmental Organisations Running Residential Homes for the Children, Aged, and Vulnerable Persons Under Social Defence",['Education & Learning']
Grant-in-aid Scheme to Village Education Committees/Urban Education Committees for minor repairs of Government School buildings,['Education & Learning']
Green Passage Scheme,['Education & Learning']
Group Insurance Scheme for Powerloom Weavers,['Education & Learning']
Gujarat Textile Policy: Capital Subsidy,['Business & Entrepreneurship']
Gujarat Textile Policy: Capital Subsidy (Fiscal Incentives to Labour Intensive Unit),['Business & Entrepreneurship']
Gujarat Textile Policy: Interest Subsidy,['Business & Entrepreneurship']
Gujarat Textile Policy: Interest Subsidy (Fiscal Incentives to Labour Intensive Unit),['Business & Entrepreneurship']
Gujarat Textile Policy: Payroll Assistance,['Business & Entrepreneurship']
Gujarat Textile Policy: Payroll Assistance (Fiscal Incentives to Labour Intensive Unit),['Business & Entrepreneurship']
Gujarat Textile Policy: Power Tariff Subsidy,['Business & Entrepreneurship']
Gujarat Textile Policy: Power Tariff Subsidy (Fiscal Incentives to Labour Intensive Unit),['Business & Entrepreneurship']
Guru Shishya Parampara,['Education & Learning']
Guruji Student Credit Card (GSCC) Scheme,['Education & Learning']
H.P. Swaran Jayanti Middle Merit Scholarship Scheme,['Education & Learning']
HIMAYAT- Deen Dayal Upadhyaya-Grameen Kaushalya Yojana,['Skills & Employment']
HSCST Fellowship Programme,['Education & Learning']
Handicapped Students Stipend Mizoram,['Education & Learning']
Haritha Haram,['Education & Learning']
Haryana Gaurav Samman Scheme for Padma Awardees,['Education & Learning']
Haryana Merit Cum Means Scheme For Minority,['Education & Learning']
Haryana Post Matric Scholarship For Minority,['Education & Learning']
Haryana Pre Matric Scholarship For Minority,['Education & Learning']
Haryana State Merit Scholarship Scheme,['Education & Learning']
Haryana State Meritorious Incentive Scheme,['Education & Learning']
Haryana State Meritorious Incentive Scheme for the Students Who Attain First Position in CBSE Annual Exams in the State,['Education & Learning']
Health and Maternity Cover for the Construction Workers,['Education & Learning']
High Risk - High Reward Research,['Education & Learning']
Higher Education And Skill Development Guarantee Scheme,['Education & Learning']
Higher Educational Finance Assistance Scheme (PBAOCWWB),['Education & Learning']
Him Kukkut Palan Yojna,['Skills & Employment']
Home Nursing Scholarship Scheme,['Education & Learning']
Home for Mentally Challenged Children,['Education & Learning']
Honorarium for Pradhan Samajpatis of Indigenous Tribal Community,['Education & Learning']
Hostel Assistance Scheme for Children of Migrant Construction Workers (GBOCWWB),['Education & Learning']
Hostel Facility for Students Availing Education in Delhi,['Education & Learning']
Hostel Scheme for Disabled Students,['Education & Learning']
Housing Assistance (Madhya Pradesh),['Education & Learning']
IASRI Scholarship For M.Sc And Ph.D,['Education & Learning']
ICAR - Post Matric Scholarship For Scheduled Caste / Scheduled Tribes Candidates,['Education & Learning']
ICAR Emeritus Professor,['Education & Learning']
ICAR Emeritus Scientist,['Education & Learning']
ICAR Junior Research Fellowship For Post-Graduate Studies In Agricultural Sciences,['Education & Learning']
ICAR National Professor And National Fellow,['Education & Learning']
ICAR Senior Research Fellowship For Post-Graduate Studies In Agricultural Sciences,['Education & Learning']
ICMR- Post Doctoral Fellowship,['Education & Learning']
ICMR-Junior Research Fellowship,['Education & Learning']
ICRO Amrit Internship Programme,['Skills & Employment']
IGSTC Industrial Fellowship- PhD Industrial Exposure Fellowship,['Education & Learning']
IGSTC Industrial Fellowship- Post Doctoral Industrial Fellowship,['Education & Learning']
INSPIRE Awards – MANAK (Million Minds Augmenting National Aspirations and Knowledge),['Education & Learning']
IT Saksham Yuva Scheme,['Skills & Employment']
IVRI Institute Scholarship For M.V.Sc. And Ph.D.,['Education & Learning']
Incentive Scheme for MSMEs in Powerloom Sector: Interest Subsidy on Term Loan,['Business & Entrepreneurship']
Incentive Scheme for MSMEs in Powerloom Sector: Subsidy for Energy Efficiency,['Business & Entrepreneurship']
Incentive Scheme for MSMEs in Powerloom Sector: Subsidy for Patent Registration,['Business & Entrepreneurship']
Incentive Scheme for MSMEs in Powerloom Sector: Subsidy for Standard Quality Compliance,['Business & Entrepreneurship']
Incentive Scheme for MSMEs in Powerloom Sector: Subsidy for State Goods and Services Tax (SGST),['Business & Entrepreneurship']
Incentive Scheme for MSMEs in Powerloom Sector: Subsidy for Water Conservation/ Environment Compliance,['Business & Entrepreneurship']
Incentive Scheme for MSMEs in Powerloom Sector: Subsidy on Stamp Duty and Registration Fees,['Business & Entrepreneurship']
Incentive Scheme for MSMEs in Powerloom Sector: Waiver of Electricity Duty,['Business & Entrepreneurship']
Incentive Scheme for MSMEs in Powerloom Sector: Work Force Welfare Assistance,['Business & Entrepreneurship']
Incentive Scheme for Sericulture Reelers,['Education & Learning']
Incentive Scheme in Civil Service (Chhattisgarh),['Education & Learning']
Incentive To Girls,['Education & Learning']
Incentive To Saharia Students For B.Ed,['Education & Learning']
Incentive for Purchase of Electric Scooter for the Daughter of a Registered Construction Worker (HBOCWWB),['Education & Learning']
Incentives for Meritorious Children (Students) of Workers (10th and 12th Class) (HBOCWWB),['Education & Learning']
"Incentives to Encourage Consumption of Local Raw Material Scheme, 2008",['Business & Entrepreneurship']
Incentives to Students who Passed the Civil Service Examination,['Education & Learning']
"Incentives to Women Entrepreneurs Scheme, 2008",['Business & Entrepreneurship']
Incubation Scheme,['Business & Entrepreneurship']
Indian Agricultural Research Institute - Scholarship,['Education & Learning']
Indian Community Welfare Fund,['Education & Learning']
Indira Gandhi Shehri Credit Card Yojana,['Skills & Employment']
Indira Gandhi Utkrisht Chattervriti Yojana,['Education & Learning']
Indira Mahila Shakti Prashikshan Evam Kaushal Sanvardhan Yojna -RS-CIT,['Education & Learning']
Indira Mahila Shakti Prashikshan Evam Koshal Sanvardhan Yojana (RS-CSEP),['Education & Learning']
Indira Priyadarshini Award,['Education & Learning']
Indirect Tax Internship Scheme In Central Board Of Indirect Taxes And Customs (CBIC),['Skills & Employment']
Indo-French Postdoctoral Research Programme for Women in Science,['Education & Learning']
Indo-French Visiting/Mobility Programme for Women in Science,['Education & Learning']
Industrial R&D Promotion Programme: Recognition Of In-House R&D Units,['Education & Learning']
Industrial Sector Scheme (HSFDC),['Skills & Employment']
Industrial Skill Development Allowance To The New Employees Employed In Industries In H.p,['Skills & Employment']
Industry Linked Biotechnology Research Scheme,['Education & Learning']
Innovation In Science Pursuit For Inspired Research (INSPIRE) - Faculty Fellowship,['Education & Learning']
Innovation In Science Pursuit For Inspired Research (INSPIRE) - Fellowship,['Education & Learning']
Innovation In Science Pursuit For Inspired Research (INSPIRE) - Internship,['Education & Learning']
Innovation In Science Pursuit For Inspired Research (INSPIRE) - Scholarship For Higher Education (SHE),['Education & Learning']
Innovations for Defence Excellence,['Business & Entrepreneurship']
Institutions of Eminence scheme,['Education & Learning']
Insurance Scheme for the Construction Workers,['Education & Learning']
Integrated Child Development Services Scheme,['Education & Learning']
Integrated Child Development Services: Chandigarh,['Education & Learning']
Integrated Horticulture Development,['Skills & Employment']
Integrated Hostel Scheme,['Education & Learning']
Integrated Pest Management Demonstration Cum Training,['Education & Learning']
Integrated Scholarship Scheme,['Education & Learning']
Intellectual Property Right Scheme Under MSME Innovative Scheme,['Business & Entrepreneurship']
Inter-caste Marriage Scheme,['Education & Learning']
Inter-state Border Areas Development Programme,['Education & Learning']
Interest Help Scheme For Graduate Doctor-Lawyer-Technical Graduate,['Education & Learning']
Interest Subsidy Eligibility Certificate (isec) Scheme,['Education & Learning']
"Interest Subsidy Scheme, 2008",['Business & Entrepreneurship']
Interest Subvention Scheme,['Business & Entrepreneurship']
International Centre for Environment Audit and Sustainable Development (iCED),['Education & Learning']
International Cooperation Scheme- Capacity Building of First Time MSE Exporters,['Business & Entrepreneurship']
International Cooperation Scheme- Market Development Assistance,['Business & Entrepreneurship']
Internship Policy Of Indian Council For Cultural Relations (ICCR),['Education & Learning']
Internship Policy Of The Madhya Pradesh Tourism Board,['Skills & Employment']
Internship Program At The Indian Patent Office,['Education & Learning']
Internship Programme At Serious Fraud Investigation Office,['Education & Learning']
Internship Programme By The Ministry Of External Affairs,['Education & Learning']
Internship Programme Of The Department Of Expenditure,['Education & Learning']
Internship Programme Of The Wildlife Crime Control Bureau (MoEFCC),['Skills & Employment']
Internship Programme for Women Students / Scholars / Social Activists / Teachers,['Education & Learning']
Internship Scheme,['Education & Learning']
Internship Scheme By The Unique Identification Authority Of India (UIDAI),['Education & Learning']
Internship Scheme For PG/Research Students In Directorate General Of Trade Remedies (DGTR),['Education & Learning']
Internship Scheme For Students Of Counselling/ Psychology/ Social Work/ Home Science Etc,['Skills & Employment']
Internship Scheme Of Employees’ Provident Fund Organisation (EPFO),['Education & Learning']
Internship Scheme Of The Department Of Economic Affairs,['Education & Learning']
Internship Scheme Of The Ministry Of Labour & Employment,['Education & Learning']
Investment Promotion Scheme (IPS) For Handicraft Artisans: Assistance For Capital Investment To Uplift The Economic Condition Of Artisans/ Persons,['Skills & Employment']
Investment Promotion Scheme (IPS) for MSME Sector: Assistance For Capital Investment In Solar Power Generation,['Business & Entrepreneurship']
Investment Promotion Scheme (IPS) for MSME Sector: Assistance For Entrepreneurship Under Skill Development,['Business & Entrepreneurship']
Investment Promotion Scheme (IPS) for MSME Sector: Assistance For Participation In Industrial Exhibitions Abroad,['Business & Entrepreneurship']
Investment Promotion Scheme (IPS) for MSME Sector: Assistance For Patent Registration /Trade Mark Registration,['Business & Entrepreneurship']
Investment Promotion Scheme (IPS) for MSME Sector: Assistance For Quality Certification,['Business & Entrepreneurship']
Investment Promotion Scheme (IPS) for MSME Sector: Assistance For Saving In Consumption Of Energy And Water,['Business & Entrepreneurship']
Investment Promotion Scheme (IPS) for MSME Sector: Assistance For Zed Certification,['Business & Entrepreneurship']
Investment Promotion Scheme (IPS) for MSME Sector: Assistance To Small And Medium Enterprises (SME) For Raising Of Capital Through SME Exchange,['Business & Entrepreneurship']
Investment Promotion Scheme (IPS) for MSME Sector: Assistance of Fixed Capital Investment Subsidy,['Business & Entrepreneurship']
Investment Promotion Scheme (IPS) for MSME Sector: Assistance of Interest Subsidy,['Business & Entrepreneurship']
Investment Promotion Scheme (IPS) for MSME Sector: Awards For MSMEs,['Business & Entrepreneurship']
Investment Promotion Scheme (IPS) for MSME Sector: Incentive For Local Employment,['Business & Entrepreneurship']
Investment Promotion Scheme (IPS) for MSME Sector: Incentives For Doubling Of Export Values,['Business & Entrepreneurship']
Investment Promotion Scheme (IPS) for MSME Sector: Reimbursement Of Free On Board (FOB) Expenses,['Business & Entrepreneurship']
Investment Promotion Scheme (IPS) for Textile Sector: Assistance Of Interest Subsidy For Textile Sector,['Business & Entrepreneurship']
Investment Promotion Scheme (IPS) for Thrust Sectors: Assistance For Furniture Sector,['Business & Entrepreneurship']
"Investment Promotion Scheme (IPS) for Thrust Sectors: Assistance For Marble, IT & ITES, Electric Vehicles & Spare Parts, Toys Units And Semi-Conduct or Industries Sectors",['Business & Entrepreneurship']
Investment Promotion Scheme (IPS) for Thrust Sectors: Scheme For Food Processing Industries,['Business & Entrepreneurship']
Investment Promotion Scheme (IPS) for Thrust Sectors: Scheme For Marine Products Processing Units,['Business & Entrepreneurship']
"Investment Promotion Scheme (IPS) for Thrust Sectors: Scheme For Medical Equipment And Accessories, Medical Diagnostics And Ayush Products Manufacturing Units",['Business & Entrepreneurship']
Investment Promotion Scheme (IPS) for Thrust Sectors: Scheme For Vaccine Manufacturing Units,['Business & Entrepreneurship']
Investment Promotion Scheme (IPS): Environment Protection Infrastructure Subsidy,['Business & Entrepreneurship']
Investment Promotion Scheme (IPS): Scheme For Reimbursement Of Stamp Duty,['Business & Entrepreneurship']
J.C. Bose Fellowship,['Education & Learning']
Jagananna Amma Vodi,['Education & Learning']
Jagananna Chedodu,['Education & Learning']
Jagananna Videshi Vidya Deevena,['Education & Learning']
Jagananna Vidya Kanuka,['Education & Learning']
Jai Bhim Mukhyamantri Pratibha Vikas Yojana,['Education & Learning']
Jal Jeevan Mission,['Education & Learning']
Jan-Nayak Karpoori Thakur Kalyan Hostel Scheme,['Education & Learning']
Jeevanam Self-Employment Scheme To Dependents Of Crime Victims,['Skills & Employment']
Jharkhand Sports Excellence Cash Award Scheme to Coaches,['Sports']
Jharkhand Sports Excellence Cash Award Scheme to Players,['Sports']
Jharkhand State Backward Classes Post-Matric Scholarship Scheme,['Education & Learning']
Jharkhand State Backward Classes Pre-Matric Scholarship Scheme,['Education & Learning']
Jharkhand State Scheduled Caste Post-Matric Scholarship Scheme,['Education & Learning']
Jharkhand State Scheduled Caste Pre-Matric Scholarship Scheme,['Education & Learning']
Jharkhand State Scheduled Tribe Post-Matric Scholarship Scheme,['Education & Learning']
Jharkhand State Scheduled Tribe Pre-Matric Scholarship Scheme,['Education & Learning']
Jiyo Parsi Scheme – Health of the Community,['Education & Learning']
Junior Hostel (Scheduled Tribes),['Education & Learning']
Junior Merit (Class - 11 To 12),['Education & Learning']
Junior Research Fellowship,['Education & Learning']
Junior Research Fellowship (JRF) And Research Associateship (RA) For Foreign Nationals,['Education & Learning']
Junior Research Fellowship In Engineering & Technology,['Education & Learning']
"Junior Research Fellowship In Sciences, Humanities, And Social Sciences",['Education & Learning']
KALIA Scholarship,['Education & Learning']
KSCSTE Emeritus Scientist Scheme,['Education & Learning']
KSCSTE Post-Doctoral Fellowship Programme,['Education & Learning']
KSCSTE Research Fellowship,['Education & Learning']
Kali Bai Bheel Medhavi Chhatra Scooty Scheme,['Education & Learning']
Kalinga Sikhya Sathi Yojana,['Education & Learning']
Kalpana Chawla Chatravriti Yojana,['Education & Learning']
Kalyana Lakshmi Pathakam,['Education & Learning']
Kamban Pugazh Literary Prize,['Education & Learning']
Kanya Dhan Scheme for SC Students,['Education & Learning']
Kanya Saksharta Protsahan Yojana,['Education & Learning']
Kanya Saksharta Protsahan Yojana (For Scheduled Caste Girls),['Education & Learning']
Kanya Sumangala Yojana,['Education & Learning']
Kanyashree Prakalpa,['Education & Learning']
Karkhandar Scheme For Development Of Craft Sector,['Education & Learning']
Karma Sathi Prakalpa,['Skills & Employment']
Kasturba Gandhi Special Term Deposit Receipt Scheme,['Education & Learning']
Kaushal Vikas Yojana,['Skills & Employment']
Kera Suraksha Insurance Scheme,['Skills & Employment']
Kerala Biotechnology Re-Entry Fellowship,['Education & Learning']
Kerala State Young Scientist Awards,['Education & Learning']
Kerala Stressed MSMEs Revival & Rehabilitation Scheme,['Business & Entrepreneurship']
Khadi Karigar Janashree Bima Yojana,['Education & Learning']
Khel Chhatravriti (Vritika) Yojana,['Sports']
Khiladi Protsahan Yojana,['Sports']
Khushi Scheme,['Education & Learning']
Kisan Vriksha Mitra Yojana,['Education & Learning']
Kishore Vaigyanik Protsahan Yojana,['Education & Learning']
Kishori Balika Yojana (Madhya Pradesh),['Education & Learning']
Krishonnati Yojana - Sub Mission On Seed And Planting Material (SMSP),['Education & Learning']
Krushi Mahotsav,['Education & Learning']
Kushal Shramik Sahay Yojana (GBOCWWB),['Education & Learning']
LIDCOM Education Loan Scheme,['Education & Learning']
LIDCOM Training Scheme,['Education & Learning']
LLB Internship Programme,['Skills & Employment']
Laadli Laxmi Scheme,['Education & Learning']
Labour Skill Training Scheme (MPBOCWWB),['Education & Learning']
Ladli Beti Scheme,['Education & Learning']
Ladli Laxmi Yojana,['Education & Learning']
Laghu Vyavassay Scheme,['Skills & Employment']
Lakshadweep Scholarship Scheme,['Education & Learning']
Lakshmir Bhandar Scheme,['Education & Learning']
Lakshya Scheme,['Education & Learning']
Lalima Abhiyaan,['Education & Learning']
Land Ports Authority Of India (LPAI) Internship Scheme,['Education & Learning']
Laptop Purchase Assistance Scheme- Gujarat Labour Welfare Board,['Education & Learning']
Laptop Scheme for Meritorious Students of SC/ST,['Education & Learning']
Laptop Supply Scheme,['Education & Learning']
Laxman Award / Rani Laxmi Bai Award Scheme,['Sports']
Laxman Award / Rani Laxmi Bai Award Scheme- Differently-abled and Posthumously,['Sports']
Leather Training Scheme - Rajasthan,['Skills & Employment']
Loan Assistance to Scheduled Castes Students for Commercial Pilot Training,['Education & Learning']
Loan Based Schemes For Safai Karamchari - Education Loan Scheme (ELS),['Education & Learning']
Loan Based Schemes For Safai Karamchari - General Term Loan (GTL),['Education & Learning']
Loan Based Schemes For Safai Karamchari - Sanitary Marts Scheme,['Education & Learning']
Loan Based Schemes For Safai Karamchari - Swachhta Udyami Yojana – Swachhta Se Sampannta Ki Aur,['Education & Learning']
Loan based Scheme for Pay and Use Community Toilets,['Skills & Employment']
Long Term Fellowship under the Human Resource Development Programme for Health Research,['Education & Learning']
Low Tension Power Tariff (LTPT) Subsidy,['Business & Entrepreneurship']
MANAGE Internship Programme,['Education & Learning']
MSME Sustainable (ZED) Certification Scheme,['Business & Entrepreneurship']
Maanki Munda Scholarship for Female Students,['Education & Learning']
Madhugram Scheme Uttarakhand,['Skills & Employment']
Madhya Pradesh Professional Talent Examination Award Scheme,['Education & Learning']
Madhyamik Drop-out Coaching,['Education & Learning']
Magnifiers - Tamil Nadu,['Education & Learning']
Mahadevi Verma Shramik Pustak Kraya Dhan Yojana,['Education & Learning']
Maharishi Balmiki Chatravriti Yojana,['Education & Learning']
Mahatama Gandhi Bunkar Bima Yojana,['Education & Learning']
Mahatma Jyothiba Phule Overseas Vidya Nidhi for BC and EBC Students,['Education & Learning']
Mahatma Jyotiba Phule Mandi shramik kalyaan yojana,['Education & Learning']
Mahatma Jyotirao Phule Jan Arogya Yojana,['Education & Learning']
Mahila Adhikarita Yojana under NSKFDC- Haryana,['Skills & Employment']
"Mahila Kamgar Kaushal Unnayan Evan Theka Shramik, Hamaal Tatha Ghareloo Mahila Kamgaar Parivar Sashaktikaran Yojana",['Education & Learning']
Mahila Kisan Yojana,['Skills & Employment']
Mahila Kisan Yojana (Maharashtra),['Education & Learning']
Mahila Samiriddhi Yojana for Backward Classes- Haryana,['Business & Entrepreneurship']
Mahila Samiriddhi Yojana for Minority Community,['Business & Entrepreneurship']
Mahila Samriddhi Yojana,['Business & Entrepreneurship']
Mahila Samridhi Yojana (Maharashtra),['Education & Learning']
Mahila Samridhi Yojana under NSKFDC- Haryana,['Skills & Employment']
Mai Bhago Vidya Scheme,['Education & Learning']
Maintenance Allowance To Backward Class Students Under Training In Sainik Schools,['Skills & Employment']
Maintenance Allowance To VJNT And SBC Students Studying In Professional Courses And Living In Hostel Attached To Professional Colleges,['Education & Learning']
Makhana Beej Vitaran,['Education & Learning']
Mamta Taruni Abhiyan,['Education & Learning']
Manav Garima Yojana,['Skills & Employment']
Marang Gomke Jaipal Singh Munda Overseas Scholarship Scheme,['Education & Learning']
Marriage Assistance To Daughters Of Prisoners,['Education & Learning']
Mass Communication Internship Programme,['Education & Learning']
Matru Jyothi - Financial Assistance For PwD Mothers,['Education & Learning']
Maulana Azad National Fellowship For Minority Students,['Education & Learning']
Medhavi Chhatr/Chhatra Shiksha Protsahan Yojana,['Education & Learning']
Medhavi Putra/Putri Chhatravritti Yojana,['Education & Learning']
MeitY - Visvesvaraya PhD Scheme For Electronics & IT,['Education & Learning']
Merit Awards,['Education & Learning']
Merit Based Award and Recognition Of High Performance In The Board Exams Of SSC And HSSC In The State Of Goa,['Education & Learning']
Merit Based Scholarship Scheme for Dhangar Students,['Education & Learning']
Merit Cum Means Based Scholarship For Students Belonging To The Minority Communities,['Education & Learning']
Merit Cum Means Linked Financial Assistance Scheme,['Education & Learning']
Merit Scholarship: Engineering University,['Education & Learning']
Merit Scholarship: Polytechnic Institutions,['Education & Learning']
Merit cum Means Scholarship: Engineering University,['Education & Learning']
Merit cum Means Scholarship: Polytechnic Institutions,['Education & Learning']
Meritorious Scholarships To Vjnt And Sbc Students Studying In Secondary Schools,['Education & Learning']
Merit·cum·Means Scholarships For Under Graduate Studies In Various Branches Of Agriculture And Animal Science Subjects,['Education & Learning']
Micro Credit Finance,['Education & Learning']
Micro Credit Finance (NSFDC),['Skills & Employment']
Micro Credit Finance under NSKFDC- Haryana,['Skills & Employment']
Mid Day Meals Scheme,['Education & Learning']
Migrants Employment Generation Programme,['Business & Entrepreneurship']
Mission Solar Charkha,['Business & Entrepreneurship']
Mizoram Research Fellowship,['Education & Learning']
Mobility Scheme,['Education & Learning']
Modernisation And Removal Of Obsolescence,['Education & Learning']
Modified Special Wheel Chairs for Persons Affected with Cerebral Palsy,['Education & Learning']
Modular Employable Skills,['Education & Learning']
Modular Functional Artificial Limbs,['Education & Learning']
Moovalur Ramamirtham Ammaiyar Higher Education Assurance Scheme,['Education & Learning']
Moovalur Ramamirtham Ammaiyar Ninaivu Marriage Assistance Scheme - II,['Education & Learning']
