scheme_name,detected_themes
Central Sector Scheme of National Fellowship for Providing Fellowship to Scheduled Caste Students to Pursue M.Phil. & PhD,['Education & Learning']
Central Vigilance Commission (CVC) Internship Scheme,['Education & Learning']
Centrally Sponsored Scheme of Post-Matric Scholarship for OBC Students for studying in India,['Education & Learning']
"Centrally Sponsored Scheme of Post-Matric Scholarship for OBC, EBC  and DNT Students for studying in India",['Education & Learning']
Centrally Sponsored Scheme of Pre-matric Scholarship to Other Backward Classes (OBC) for Studies in India,['Education & Learning']
Centrally-Sponsored Scheme Of Pre-Matric Scholarship For Scheduled Caste Students Studying In Classes 9th & 10th,['Education & Learning']
Chanakya Scheme for Swayam Upadhi,['Business & Entrepreneurship']
Chanakya Swayam Upadhi Scheme for Micro Entrepreneurship - Transport Operator,['Skills & Employment']
Chetan Chauhan Labor Sports Promotion Scheme,['Sports']
Chhatraon Ke Liye Protsahan Rashi,['Education & Learning']
Chhatrawas (Scheduled Caste),['Education & Learning']
Chief Minister Agriculture and Food Processing Scheme,['Business & Entrepreneurship']
Chief Minister BC & EBC Chhatravas Anudan Yojana,['Education & Learning']
Chief Minister Breakfast Scheme,['Education & Learning']
Chief Minister Career Advancement in Biotechnology,['Education & Learning']
Chief Minister Divyangjan Empowerment Scheme (Sambal),['Education & Learning']
Chief Minister EBC Civil Seva Protsahan Yojana,['Education & Learning']
Chief Minister Floriculture Mission,['Skills & Employment']
Chief Minister Higher Education Encouragement Scholarship Scheme,['Education & Learning']
Chief Minister Higher Education Scholarship Scheme,['Education & Learning']
Chief Minister Kanya Utthan Yojana,['Education & Learning']
Chief Minister Ladli Behna Yojana,['Skills & Employment']
Chief Minister Merit Award,['Education & Learning']
Chief Minister Nari Shakti Yojana,['Skills & Employment']
Chief Minister Rural Path Vendor Loan Scheme,['Skills & Employment']
Chief Minister's Adarsh Gram Yoiana 2017,['Education & Learning']
Chief Minister's COVID-19 Affected Livelihood Support Scheme,['Education & Learning']
Chief Minister's Jeevan Jyoti Swaniyojan Yojana,['Skills & Employment']
Chief Minister's Micro Finance Initiative,['Business & Entrepreneurship']
Chief Minister's Overseas Scholarship Scheme for Minorities,['Education & Learning']
Chief Minister's Self Employment Scheme,['Skills & Employment']
Chief Ministergi Artistesinggi Tengbang (CMAT): Support For Purchase Of Instruments / Equipment,['Education & Learning']
Chief Ministergi Shotharabasingi Tengbang (CMST): Scholarship Of Students With Disabilities,['Education & Learning']
Chief Ministers House Rent,['Education & Learning']
Chief Ministers Special Rural Development Fund (CMSRDF),['Education & Learning']
Chief Minister’s College Students Rehabilitation Scheme (CMCSRS),['Education & Learning']
Chief Minister’s Girl Child Protection Scheme-I,['Education & Learning']
Chief Minister’s Girl Child Protection Scheme-II,['Education & Learning']
Chief Minister’s Paryatan Siksha Yojana,['Education & Learning']
Chief Minister’s Scheme For Wood Carving Artists,['Skills & Employment']
Chief Minister’s Shasakt Kisan Yojana,['Skills & Employment']
Chief Minister’s Startup/innovation Projects/new Industries,['Skills & Employment']
Chief Minister’s UPSC Combined Civil Services Coaching Scheme,['Education & Learning']
Chief Minister’s Yuva Kaushal Yojana,['Skills & Employment']
Chikitsa Pratipoorti Yojana,['Education & Learning']
Child Benefit Scheme (UKBOCWWB),['Education & Learning']
Children Education Allowance,['Education & Learning']
Children Education Assistance Fund,['Education & Learning']
Children With Special Needs Under Goa Sarva Shiksha Abhivan,['Education & Learning']
"Civil Service Incentive (De-Notified, Nomadic and Semi-nomadic communities )",['Education & Learning']
Civil Service Incentive Scheme (Madhya Pradesh),['Education & Learning']
"Coaching Assistance Scheme For Scheduled Caste Students For Pre-Exam Preparation Like NEET, JEE, GUJCET",['Education & Learning']
Coaching Assistance Scheme for Preparation of Recruitment Exams for Scheduled Caste Students,['Education & Learning']
"Coaching Assistance to Scheduled Castes Students for Preparation of Examination Like IIM, NIFT, NLU, CEPT",['Education & Learning']
Coaching Help Scheme,['Education & Learning']
Coaching Help Scheme for JEE-GUJCET-NEET Exams,['Education & Learning']
Coaching Schemes For Sc/st/obc (non-creamy Layer) & Minority Students For Universities,['Education & Learning']
Coaching by Private Institutes for All India Services Civil Services Examination,['Education & Learning']
Coir Udyami Yojana,['Business & Entrepreneurship']
Coir Vikas Yojana- Coir Industry Technology Upgradation Scheme,['Business & Entrepreneurship']
Coir Vikas Yojana- Export Market Promotion Scheme,['Business & Entrepreneurship']
Coir Vikas Yojana-Skill Upgradation and Mahila Coir Yojana,['Business & Entrepreneurship']
Collaborative Research Scheme (CRS),['Education & Learning']
Community Based Training Scheme,['Skills & Employment']
Community Canning & Training On Fruit Preservation,['Skills & Employment']
Competitive Exam Coaching,['Education & Learning']
Composite Loan Scheme,['Skills & Employment']
Comprehensive Educational Loan Scheme - Sikkim,['Education & Learning']
Comprehensive Handicrafts Cluster Development Programme,['Business & Entrepreneurship']
Computer Training Scheme,['Education & Learning']
Consolidated Stipend Scheme for Scheduled Caste Students Pursuing Higher Education,['Education & Learning']
Construction of Hostels for OBC Boys and Girls,['Education & Learning']
Craftsman Training Scheme - Maharashtra,['Education & Learning']
Cycle Distribution Scheme,['Education & Learning']
D. D. Kosambi Research Fellowship Scheme,['Education & Learning']
DEVELOPMENT OF HANDICRAFTS,['Education & Learning']
DPIIT Internship Scheme,['Education & Learning']
Dairy Farming Scheme (HSFDC),['Skills & Employment']
Dalit Bandhu,['Education & Learning']
Dayanand Bandodkar Scheme For Higher Education For Orphans,['Education & Learning']
Deen Dayal Disabled Rehabilitation Scheme,['Education & Learning']
Deen Dayal Divyangjan Pension Scheme - Assam,['Education & Learning']
Deen Dayal SPARSH Yojana (Scholarship For Promotion Of Aptitude & Research In Stamps As A Hobby),['Education & Learning']
Deen Dayal Upadhyay Grameen Kaushalya Yojana,['Skills & Employment']
Deen Dayal Upadhyay Kaushal Kendra (DDUKK)- Mega Skill Centre,['Skills & Employment']
Deen Dayal Upadhyaya Bunkar Yojana,['Education & Learning']
Deendayal Antyodaya Yojana - National Rural Livelihoods Mission,['Skills & Employment']
Delhi Ladli Scheme,['Education & Learning']
Design Scheme Under MSME Innovative Scheme,['Business & Entrepreneurship']
Development Of Playfield Under CMSGUY,['Education & Learning']
Development of Choir Industries,['Skills & Employment']
Development of Industrie-Training Scheme,['Skills & Employment']
Devnarayan Chhatra Cycle Scheme,['Education & Learning']
Devnarayan Gurukul Yojana,['Education & Learning']
Devnarayan Post Matric Scholarship Scheme,['Education & Learning']
Devnarayan Pratibhawan Chhatra Protsahan Yojana,['Education & Learning']
Devnarayan Pre-Matric Scholarship Scheme,['Education & Learning']
Devnarayan Scooty Distribution And Incentive Scheme,['Education & Learning']
Digital India Internship Scheme,['Education & Learning']
Digital J&K Internship Scheme,['Education & Learning']
Disable Marriage Scheme (Divyang Lagna Sahay),['Education & Learning']
Disabled State Level Award Scheme,['Skills & Employment']
Disha - Early Intervention and School Readiness Scheme,['Education & Learning']
Distance Education Scheme for Girls,['Education & Learning']
"Distance Education Scholarship–Scholarship For Disabled Students Pursuing Degree, PG Courses",['Education & Learning']
Distribution of Free Books and Stationery to SC/ST Students,['Education & Learning']
District Central Cooperative Banks and through its Branches: For Women Entrepreneurs,['Business & Entrepreneurship']
Divyang Shiksha Protsahan Yojana,['Education & Learning']
Divyangjan Scholarship Scheme,['Education & Learning']
Dr Ambedkar Central Sector Scheme of Interest Subsidy on Educational Loans for Overseas Studies for Other Backward Classes (OBCs) and Economically Backward Classes (EBCs),['Education & Learning']
Dr. A.P.J. Abdul Kalam Meritorious Students Incentive Scheme (Class 12th Passed),['Education & Learning']
Dr. APJ Abdul Kalam Shramik Pravidhik Shiksha Sahaayata Yojana,['Education & Learning']
Dr. Ambedakar Centrally Sponsored Scheme of Post-Matric Scholarships for the Economically Backward Class (EBC) Students,['Education & Learning']
Dr. Ambedkar Foundation Essay Competition Scheme for Class 10th-12th & Colleges/Universities/Institutions Students in 22 Indian Languages and English,['Education & Learning']
Dr. Ambedkar Medhavi Chattar Sansodhit Yojna,['Education & Learning']
Dr. Ambedkar Medhavi Chhatravriti Yojna to Other Backward Classes Students,['Education & Learning']
Dr. Ambedkar Medhavi Chhatravriti Yojna to Scheduled Caste Students,['Education & Learning']
Dr. Ambedkar Medical Aid Scheme (Revised – 2009),['Education & Learning']
Dr. B. R. Ambedkar State Award To SC/ST/OBC/Minorities Students,['Education & Learning']
Dr. B.R. Ambedkar Memorial Award to Scheduled Caste Students,['Education & Learning']
Dr. Baba Saheb Ambedkar Loan for Higher Study in Foreign Countries,['Education & Learning']
Dr. Bhim Rao Ambedkar Meritorious Student Award Scheme,['Education & Learning']
Dr. Bhimrao Ambedkar Aarthik Kalyan Yojana,['Skills & Employment']
Dr. D.S. Kothari Post Doctoral Fellowships In Sciences,['Education & Learning']
Dr. D.S. Kothari Research Grant For Newly Recruited Faculty Members,['Education & Learning']
Dr. Dharmambal Ammaiyar Ninaivu Widow Remarriage Assistance Scheme-II,['Education & Learning']
Dr. Muthulakshmi Reddy Ninaivu Inter-caste Marriage Assistance Scheme-II,['Education & Learning']
Dr. P. G. Solanki Scheme for Stipend to Scheduled Caste Lawyers,['Skills & Employment']
Dr. Panjabrao Deshmukh Hostel Maintenance Allowance,['Education & Learning']
Dr. S. Radhakrishnan UGC Post-Doctoral Fellowship,['Education & Learning']
Dr.Babasaheb Ambedkar Udyog Uday Yojana: Assistance for Interest Subsidy (Manufacturing Sector),['Business & Entrepreneurship']
Dr.Babasaheb Ambedkar Udyog Uday Yojana: Assistance for Interest Subsidy (Service Sector),['Business & Entrepreneurship']
Dr.Babasaheb Ambedkar Udyog Uday Yojana: Assistance for Power Connection Charges,['Business & Entrepreneurship']
Dr.Babasaheb Ambedkar Udyog Uday Yojana: Assistance for Quality Certification,['Business & Entrepreneurship']
Dr.Babasaheb Ambedkar Udyog Uday Yojana: Assistance for Raising Capital through SME Exchange,['Business & Entrepreneurship']
Dr.Babasaheb Ambedkar Udyog Uday Yojana: Assistance for Technology Acquisition,['Business & Entrepreneurship']
Dr.Babasaheb Ambedkar Udyog Uday Yojana: Assistance in Implementation of Information and Communication Technology (ICT),['Business & Entrepreneurship']
Dr.Babasaheb Ambedkar Udyog Uday Yojana: Assistance in Rent to MSEs,['Business & Entrepreneurship']
Dr.Babasaheb Ambedkar Udyog Uday Yojana: Assistance of Capital Investment Subsidy,['Business & Entrepreneurship']
Dr.Babasaheb Ambedkar Udyog Uday Yojana: Assistance to GIDC for Developing Multi-Storied Shed in Estates,['Business & Entrepreneurship']
Dr.Babasaheb Ambedkar Udyog Uday Yojana: Assistance to MSEs for Shed Developed by Private Developer,['Business & Entrepreneurship']
Dr.Babasaheb Ambedkar Udyog Uday Yojana: Assistance to MSME Manufacturing Sector Participation in the Exhibition (National and International),['Business & Entrepreneurship']
Dr.Babasaheb Ambedkar Udyog Uday Yojana: Assistance to Micro and Small Enterprises (MSE) of SC/ST for Plot Developed by GIDC,['Business & Entrepreneurship']
"Dr.Babasaheb Ambedkar Udyog Uday Yojana: Assistance to basic industrial infrastructure (Water, Gas and Approach Road)",['Business & Entrepreneurship']
Dr.Babasaheb Ambedkar Udyog Uday Yojana: Financial Support to MSMEs in ZED Certification,['Business & Entrepreneurship']
Dulari Scheme,['Education & Learning']
E-Medhabruti,['Education & Learning']
E-YUVA Scheme: BIRAC’s E-YUVA Fellows (for under graduate students),['Education & Learning']
E-YUVA Scheme: BIRAC’s Innovation Fellows (for post graduates and above),['Education & Learning']
E-YUVA Scheme: E-YUVA Centers,['Business & Entrepreneurship']
E.V.R. Maniammaiyar Ninaivu Marriage Assistance Scheme for Daughter’s of Poor Widows: Scheme-II,['Education & Learning']
Early Intervention Centre for the Visually Impaired,['Education & Learning']
Economic Help To Sahariya Tribal Girl Students (Class 11 And 12),['Education & Learning']
Economic Help To Tribal Girls For Higher Education (Class 11 & 12),['Education & Learning']
Economic Help To Tribal Girls For Higher Education (College Level),['Education & Learning']
Education Assistance - Folk Artist,['Education & Learning']
Education Assistance for the Construction Workers,['Education & Learning']
Education Assistance/Ph.D Scheme (GBOCWWB),['Education & Learning']
Education Development Scholarship for Single Girl Child,['Education & Learning']
Education Loan Scheme,['Education & Learning']
Education Loan Scheme (NSFDC),['Education & Learning']
Education Loan Scheme - Delhi,['Education & Learning']
Education Loan Scheme under NSFDC- Haryana,['Education & Learning']
Education Loan Scheme under NSKFDC- Haryana,['Education & Learning']
Education Loan Scheme- Credit Line 1 for Minority Community,['Education & Learning']
Education Loan Scheme- Credit Line 2 for Minority Community,['Education & Learning']
Education Loan for Persons with Disabilities- Haryana,['Education & Learning']
Educational Allowances to the Children of Widows,['Education & Learning']
Educational Assistance (A.B.O.C.W.W.B),['Education & Learning']
Educational Assistance (ANBOCWWB),['Education & Learning']
Educational Assistance (Scheme for the Pre-Matric and Post-Matric Scholarship to Children of Construction Workers Registered with the MBOCWWB),['Education & Learning']
Educational Assistance For Children Of Victims Of Crime,['Education & Learning']
Educational Assistance To Children Of Prisoners,['Education & Learning']
Educational Assistance To Children Of Prisoners (Pursuing Professional Course),['Education & Learning']
Educational Assistance for Degree Course,['Education & Learning']
Educational Assistance for Government Recognised Diploma Courses,['Education & Learning']
Educational Assistance for Medical and Engineering Courses,['Education & Learning']
Educational Assistance to Children of Women Headed Families,['Education & Learning']
Educational Assistance to the 10th to 12th Students,['Education & Learning']
Educational Assistance to the Children Studying in 1st to 7th and 8th to 10th Class,['Education & Learning']
Educational Assistance to the Children of the Registered Worker Studying in 11th and 12th Standard,['Education & Learning']
Educational Award Scheme - Gujarat Labour Welfare Board,['Education & Learning']
Educational Study Scheme,['Education & Learning']
Eklavya Prashikshan Yojana,['Education & Learning']
"Eklavya Prashikshan Yojana - Coaching To Scheduled Tribe Student Studying In Class Xth, XIth & XIIth",['Education & Learning']
Emeritus Fellowship,['Education & Learning']
Employability Excellence with College Education & Learning (EXCEL),['Education & Learning']
Empower ST/SC Communities using ICT Tools through IT Knowledge Centre (ITKC),['Education & Learning']
Encouragement Scheme for Taking Admission in Science and Contemporary Subjects,['Education & Learning']
Endeavour To Empower-Skill Development,['Skills & Employment']
Entrepreneur Support Scheme,['Business & Entrepreneurship']
Entrepreneurship Development by SC & ST Women in Science Technology Engineering Mathematics,['Education & Learning']
Entrepreneurship and Skill Development Programme,['Business & Entrepreneurship']
Establishing Aavin Parlour for Differently Abled Persons,['Skills & Employment']
Establishment of 50 Milch Animals Dairy Unit,['Skills & Employment']
Establishment of Integrated Educational Complexes,['Education & Learning']
Excellent Work Award Scheme for Social Worker of De-Notified Communities,['Education & Learning']
Export Promotion Council Membership Reimbursement Scheme for Scheduled Caste/Scheduled Tribe,['Business & Entrepreneurship']
Exposure Visits To The Assam Legislative Assembly,['Education & Learning']
Exposure Visits of Government of Odisha Delegates/Representatives to Singapore and Dubai,['Education & Learning']
Farm Machinery Bank (FMB)/Farm Machinery Hub (FMH),['Skills & Employment']
Farmer Suicide Ex-Gratia,['Education & Learning']
Fee Reimbursement Scheme,['Education & Learning']
Fee Waiver Scheme For SC/ST Students Pursuing Higher Education,['Education & Learning']
Fellowship For Superannuated Faculty Members,['Education & Learning']
Fellowship Scheme for M.Phil & Ph.D for Scheduled Caste Students (Maharaja Sayajirao Gayakvad Scholarship),['Education & Learning']
Financial Aid For Providing Hostel Facility To Transgender Students,['Education & Learning']
Financial Assistance For Aids And Appliances For Disabled Persons,['Education & Learning']
Financial Assistance For Cultural Activities In Performing Arts For Building Grants Including Studio Theatres,['Education & Learning']
Financial Assistance For Development Of Buddhist/Tibetan Arts And Culture,['Education & Learning']
Financial Assistance For Education Of Children Of Registered Worker (HBOCWWB),['Education & Learning']
Financial Assistance For Persons With Special Needs,['Education & Learning']
Financial Assistance For Promotion Of Guru-Shishya Parampara (Repertory Grant),['Education & Learning']
Financial Assistance For Purchase Of Stationery To SC/ST/OBC/Minorities Students,['Education & Learning']
Financial Assistance On Marriage Of Children (HBOCWWB),['Education & Learning']
Financial Assistance Scheme For Higher Competitive/ Entrance Examination To Scheduled Castes/ Backward Classes Students,['Education & Learning']
Financial Assistance To Cultural Organizations With National Presence,['Education & Learning']
Financial Assistance To Dependent Children Of Widows And Destitute Women,['Education & Learning']
Financial Assistance To Disabled For Self Employment,['Skills & Employment']
"Financial Assistance To Disabled Students Pursuing (10th, 11th, 12th Equivalent Exams)",['Education & Learning']
Financial Assistance To Ex-Convicts,['Skills & Employment']
Financial Assistance To Institutions/Societies Belonging To Scheduled Castes/Backward Classes,['Education & Learning']
Financial Assistance To Non-School Going Disabled Children Scheme,['Education & Learning']
Financial Assistance To Pre-primary School In Remote Areas,['Education & Learning']
Financial Assistance To Self-Employment For Trained Disabled Persons,['Skills & Employment']
Financial Assistance To The Child Victims Of Violence Under TheNational Foundation For Communal Harmony,['Education & Learning']
Financial Assistance for Coaching Classes (HBOCWWB),['Education & Learning']
Financial Assistance for Coaching- Haryana Labour Welfare Board,['Education & Learning']
Financial Assistance for Education (GBOCWWB),['Education & Learning']
Financial Assistance for Education for the Construction Workers,['Education & Learning']
Financial Assistance for Education of Children of Beneficiary,['Education & Learning']
Financial Assistance for Education of Children of Registered Construction Worker,['Education & Learning']
Financial Assistance for Education of Self/ Children of Beneficiaries,['Education & Learning']
Financial Assistance for Education- Haryana Silicosis Board,['Education & Learning']
Financial Assistance for Encouraging Worker's Children's Participation in Sports Activities- Haryana Labour Welfare Board,['Sports']
Financial Assistance for Hostel Facility in Professional/Technical Institutions (HBOCWWB),['Education & Learning']
Financial Assistance for Private Self-Financed Technical Institutions,['Education & Learning']
Financial Assistance for Professional/Technical Courses (HBOCWWB),['Education & Learning']
"Financial Assistance for Purchasing School Uniforms, Books and Notebooks from Class 1st to 12th for Children of Workers- Haryana Labour Welfare Board",['Education & Learning']
Financial Assistance for Studies (BBOCWWB),['Education & Learning']
Financial Assistance for the Education of Children of the Beneficiary (O.B.O.C.W.W.B),['Education & Learning']
Financial Assistance to Former Sports Person of UP,['Sports']
Financial Assistance to Newlyweds under Kanyadan Yojana (Vijabhaj),['Education & Learning']
Financial Assistance to Non Governmental Organisations,['Education & Learning']
"Financial Assistance to SC Students Studying in Medical, Engineering and Diploma Course for Purchasing Educational Instrument",['Education & Learning']
Financial Assistance to SC Students for Pursuing Higher Studies Abroad,['Education & Learning']
"Financial Assistance to ST Students under ""Gagan Bharari Shiksha Yojana""",['Education & Learning']
"Financial Assistance to Sportspersons to Pursue Sports Coaching Courses Conducted by SAI, NSNIS, Patiala as a Part of Skill Development Programme to Improve their Employability",['Education & Learning']
Financial Assistance to Take up Value Addition to Seafood,['Business & Entrepreneurship']
Financial Assistance to the Teachers/Lecturers Children who taken loan from Nationalised Banks for studying Medical/Engineering Courses,['Education & Learning']
Financial Assistive Devices for Persons with Disabilities,['Skills & Employment']
Financial Grant for Sports Associations,['Sports']
Financial Support Scheme,['Education & Learning']
Financial Support To The Students Of N.E.R For Higher Professional Courses (NEC Merit Scholarship),['Education & Learning']
Financial assistance to Meritorious Scheduled Tribe Students who have Passed First Division from Board and University,['Education & Learning']
Fitter Training to Hearing Impaired Persons,['Skills & Employment']
Food Bill Assistance,['Education & Learning']
Food Bill Assistance to SC Students,['Education & Learning']
Food Safety & Standards Authority Of India (FSSAI) Internship Scheme,['Education & Learning']
Foreign Education Scheme,['Education & Learning']
Forest And Climate Change Internship Scheme,['Education & Learning']
Foster Care Scheme (Vatsalaya),['Education & Learning']
Free Bicycle Distribution Scheme,['Education & Learning']
"Free Bicycle Distribution to Students of Vimukt, Ghumantu and Ardhghumantu Communities",['Education & Learning']
Free Books Scheme for Scheduled Caste Students Pursuing Higher Education,['Education & Learning']
"Free Caste Hostel (De-Notified, Nomadic and Semi-Nomadic Communities)",['Education & Learning']
Free Coaching Scheme for SC and OBC Students,['Education & Learning']
Free Coaching for Students with Disabilities,['Education & Learning']
Free Cycles to SC Girl Students Studying in Standard IX (Sarasvati Sadhna Yojana),['Education & Learning']
Free Distribution of Text Books to Students,['Education & Learning']
Free Education For Sports Medal Winners / Participants Of National/ International Events,['Education & Learning']
Free Education Scheme,['Education & Learning']
"Free Education Scholarship for Professional Courses (Engineering, Medical, Agriculture, Veterinary, and Law)",['Education & Learning']
Free Education Scholarship for Three-Year Diploma (Polytechnic Courses),['Education & Learning']
Free Employment Oriented Training to Educated Unemployed Youth of Backward Class and Minority Class,['Education & Learning']
Free Passport Scheme,['Education & Learning']
Free Scooty Distribution for Girls (GEN-CATEGAORY-EWS),['Education & Learning']
Free Studentship,['Education & Learning']
Free Supply of Note Books to the Children of Poor Widows,['Education & Learning']
Free Supply of Text Books,['Education & Learning']
FutureSkills Prime Incentive Program,['Education & Learning']
GITANJALI HOUSING SCHEME,['Education & Learning']
Gagan Bharari Shiksha Yojana for OBC (Dhangar) Students,['Education & Learning']
Gagan Bharari Shiksha Yojana for SC Students,['Education & Learning']
Ganesh Shankar Vidyaarthi Shramik Puraskar Rashi Yojana,['Education & Learning']
Gaon Ki Beti,['Education & Learning']
Gargi Puruskar Yojana,['Education & Learning']
Gatidhara Scheme,['Skills & Employment']
Gau Palan Yojana,['Skills & Employment']
Gausevak Training (Initial and Refresher),['Skills & Employment']
Gayathri Scheme for Academic Excellence,['Education & Learning']
General Poor Class Scholarship (Class 6 to 8),['Education & Learning']
General Pre Matric Scholarship-Uttar Pradesh,['Education & Learning']
Generator Subsidy,['Business & Entrepreneurship']
Girl Students Health & Hygiene Scheme,['Education & Learning']
Girls Literacy Promotion Scheme for Class 11th,['Education & Learning']
"Goa (Technical/ Vocational Training To Sex Workers And Sexually Abused Women) Scheme, 2013 (PRABHAT)",['Education & Learning']
Goa Mediclaim Scheme,['Education & Learning']
Goa State Best Library and Best Librarian Award,['Education & Learning']
Goa State Cultural Award for Institution,['Education & Learning']
"Goa State Employment Subsidy Scheme for the Industries, 2008",['Business & Entrepreneurship']
"Goa State Financial Incentives to the Industries for Certification and Patenting Scheme, 2008",['Education & Learning']
Gomant Vibhushan Award,['Education & Learning']
Gopabandhu Sikhya Sahayata Yojana,['Education & Learning']
Government Hostel for Working Women/ Girl Students,['Education & Learning']
Government Institute for the Mentally Retarded - Tamil Nadu,['Education & Learning']
