scheme_name,detected_themes
AICTE SHORT TERM TRAINING PROGRAMME-SFURTI SCHEME,['Education & Learning']
Consortia & Tender Marketing Scheme,['Business & Entrepreneurship']
Incentive Scheme for MSMEs in Powerloom Sector: State Capital Investment Subsidy,['Business & Entrepreneurship']
Indira Mahila Shakti Udyam Protsahan Yojana,['Business & Entrepreneurship']
Nirman Shramik Jeevan va Bhavishya Suraksha Yojana,['Education & Learning']
Pre-Matric Scholarship for Backward Class Students,['Education & Learning']
Safai Karmakaar Ke Putr/Putri Hetu Vishesh Coaching Yojana,['Education & Learning']
The West Bengal Incentive Scheme: Capacity Utilisation,['Business & Entrepreneurship']
The West Bengal Incentive Scheme: Reimbursement of Stamp Duty and Registration Fee,['Education & Learning']
The West Bengal Incentive Scheme: State Capital Investment Subsidy,['Business & Entrepreneurship']
The West Bengal Incentive Scheme: Tourism Promotion Assistance in lieu of Interest Subsidy,['Business & Entrepreneurship']
West Bengal Textile Incentive Scheme: Incentive for Energy Efficiency,['Business & Entrepreneurship']
West Bengal Textile Incentive Scheme: Power Subsidy,['Business & Entrepreneurship']
West Bengal Textile Incentive Scheme: State Capital Investment Subsidy,['Business & Entrepreneurship']
West Bengal Textile Incentive Scheme: Subsidy for Water conservation/ Environment Compliance,['Business & Entrepreneurship']
West Bengal Textile Incentive Scheme: Waiver of Electricity Duty,['Business & Entrepreneurship']
West Bengal Textile Incentive Scheme: Waiver of Fees for Land Conversion and Mutation,['Business & Entrepreneurship']
"""Advance / High Skill Training"" Component of the ""Development of Industries"" Scheme",['Skills & Employment']
"""Advance/High Skill Training in Coir"" Component of the ""Development of Coir"" Scheme",['Education & Learning']
"""Advanced Training in Handicrafts"" Component of the ""Development of Handicrafts"" Scheme",['Education & Learning']
"""Assistance for Technology Acquisition"" under ""Motivation of Entrepreneurs to Start Industries and Fiscal Assistance to Capital Intensive Industries""",['Business & Entrepreneurship']
"""Capital Investment Subsidy (for New and Existing Industries)"" under ""Motivation of Entrepreneurs to Start Industries and Fiscal Assistance to Capital Intensive Industries""",['Business & Entrepreneurship']
"""Capital Investment Subsidy: 5% Additional Capital Investment Subsidy to Karaikal Region"" under ""Motivation of Entrepreneurs to Start Industries and Fiscal Assistance to Industries""",['Business & Entrepreneurship']
"""Capital Investment Subsidy: Information Technology (IT) / Information Technology Enabled Services (ITES) Industries"" under ""Motivation of Entrepreneurs to Start Industries and Fiscal Assistance to Industries""",['Business & Entrepreneurship']
"""Capital Investment Subsidy: Physically Handicapped Persons/ Ex-Servicemen"" under ""Motivation of Entrepreneurs to Start Industries and Fiscal Assistance to Industries""",['Business & Entrepreneurship']
"""Capital Investment Subsidy: SC/ST/Women Entrepreneurs"" Component of the ""Motivation of Entrepreneurs to Start Industries and Fiscal Assistance to Industries"" Scheme",['Business & Entrepreneurship']
"""Entrepreneurship Development Programme"" Component of the ""Development of Coir"" Scheme",['Business & Entrepreneurship']
"""Grant of Margin Money for Availing Capital Loan"" Component of the ""Development of Coir"" Scheme",['Business & Entrepreneurship']
"""Grant of Margin Money for Availing the Capital Loan"" Component of the ""Development of Silk"" Scheme",['Business & Entrepreneurship']
"""Green and Eco-Friendly Measures"" under “Motivation of Entrepreneurs to Start Industries and Fiscal Assistance to Industries - State Awards to Micro, Small and Medium Enterprises”",['Business & Entrepreneurship']
"""In-Plant Training"" Component of the ""Development of Industries"" Scheme",['Skills & Employment']
"""Infrastructure Development Subsidy (For IT/ITES)"" under ""Motivation of Entrepreneurs to Start Industries and Fiscal Assistance to Capital Intensive Industries""",['Business & Entrepreneurship']
"""Innovation in Technology [Product (or) Process]"" under “Motivation of Entrepreneurs to Start Industries and Fiscal Assistance to Industries - State Awards to Micro, Small and Medium Enterprises”",['Business & Entrepreneurship']
"""Interest Subsidy (For Micro, Small, Medium and Large New Industries)"" under ""Motivation of Entrepreneurs to Start Industries and Fiscal Assistance to Industries - Various Incentives""",['Business & Entrepreneurship']
"""Interest Subsidy"" under ""Motivation of Entrepreneurs to Start Industries and Fiscal Assistance to Industries""",['Business & Entrepreneurship']
"""Outstanding Artisan of the Year"" under “Motivation of Entrepreneurs to Start Industries and Fiscal Assistance to Industries - State Awards to Micro, Small and Medium Enterprises”",['Business & Entrepreneurship']
"""Outstanding Entrepreneur"" under “Motivation of Entrepreneurs to Start Industries and Fiscal Assistance to Industries - State Awards to Micro, Small and Medium Enterprises”",['Business & Entrepreneurship']
"""Outstanding Exporter"" under “Motivation of Entrepreneurs to Start Industries and Fiscal Assistance to Industries - State Awards to Micro, Small and Medium Enterprises”",['Business & Entrepreneurship']
"""Outstanding SC/ST Entrepreneur"" under “Motivation of Entrepreneurs to Start Industries and Fiscal Assistance to Industries - State Awards to Micro, Small and Medium Enterprises”",['Business & Entrepreneurship']
"""Rent Subsidy"" under ""Motivation of Entrepreneurs to Start Industries and Fiscal Assistance to Industries""",['Business & Entrepreneurship']
"""SUPER 30"" Scheme",['Education & Learning']
"""Subsidy to Pollution Control Equipment"" under ""Motivation of Entrepreneurs to Start Industries and Fiscal Assistance to Capital Intensive Industries""",['Business & Entrepreneurship']
"""Training in Handicrafts"" Component of the ""Development Of Handicrafts"" Scheme",['Education & Learning']
"""Training in Silk"" Component of the ""Development of Silk"" Scheme",['Skills & Employment']
"""Vocational Training"" Component of the ""Development of Industries"" Scheme",['Skills & Employment']
15 Days Skill Up-gradation Training,['Skills & Employment']
25% Capital Investment Subsidy Scheme,['Business & Entrepreneurship']
60% and above Disability Allowances,['Education & Learning']
AGR-61 Agro Service Providers for the Purpose of Making Farming More Profitable With the Help of Farm Mechanization,['Education & Learning']
AICTE - Distinguished Chair Professor Fellowship,['Education & Learning']
AICTE - Grant For Augmenting Infrastructure In North Eastern Region,['Education & Learning']
AICTE - Research Promotion Scheme (RPS),['Education & Learning']
"AICTE - Scheme For Promoting Interests, Creativity And Ethics Among Students",['Education & Learning']
"AICTE - YOUTH UNDERTAKING VISIT FOR ACQUIRING KNOWLEDGE (YUVAK): STUDY TOUR OF ATAL TUNNEL, HIMACHAL PRADESH",['Education & Learning']
AICTE e-Shodh Sindhu Scheme (eSS),['Education & Learning']
AICTE – Mitacs Globalink Research Internship (GRI) Scheme,['Education & Learning']
AICTE – Saksham Scholarship Scheme For Specially-Abled Student (Degree),['Education & Learning']
AICTE – Saksham Scholarship Scheme For Specially-Abled Student (Diploma),['Education & Learning']
AICTE- TECHNICAL UNIVERSITY JOINT TRAINING PROGRAMS FOR TEACHERS,['Education & Learning']
AICTE- Technical University Joint Training Programs for Librarians,['Education & Learning']
"AICTE-IDEA (Idea Development, Evaluation & Application) LAB SCHEME",['Education & Learning']
AICTE-INAE Distinguished Visiting Professorship Scheme,['Education & Learning']
AICTE-INAE Travel Grant Scheme For Engineering Students From AICTE Approved Engineering College/Institution,['Education & Learning']
AICTE-ISTE INDUCTION/REFRESHER PROGRAMME SCHEME,['Education & Learning']
AICTE-LILAVATI AWARD,['Education & Learning']
AICTE-Margdarshan scheme,['Education & Learning']
AICTE-National Initiative for Training of Technical Teachers (for Inductee Teachers) Scheme,['Education & Learning']
AICTE-PROFESSIONAL DEVELOPMENT SCHEME,['Education & Learning']
AICTE-QUALITY IMPROVEMENT (FOREIGN UNIVERSITY) PROGRAMME,['Education & Learning']
"AICTE-SHORT TERM TRAINING PROGRAMME (STTP) (UT-J&K,LADAKH AND NER)",['Education & Learning']
AICTE-Swanath Scholarship Scheme For Students,['Education & Learning']
AICTE-Technical Book Writing & Translation Scheme,['Education & Learning']
AICTE-Training programs for Physical Education Trainers/Sport-Games Teachers/Director of Sports,['Education & Learning']
ASEAN-India Research Training Fellowship,['Education & Learning']
Aam Aadmi Bima Yojana,['Education & Learning']
Aam Aadmi Bima Yojana (Maharashtra),['Education & Learning']
Aamar Dukan On Wheels,['Skills & Employment']
Aapki Beti Hamari Beti,['Education & Learning']
Aapki Beti Yojana,['Education & Learning']
Aatmanirbhar Gujarat Scheme for Assistance to Mega Industries: Net SGST reimbursement,['Business & Entrepreneurship']
Aatmanirbhar Gujarat Scheme for Assistance to Mega Industries: Reimbursement of SGST Paid on Capital Goods,['Business & Entrepreneurship']
Aatmanirbhar Gujarat Scheme for Assistance to Mega Industries: Reimbursement of Stamp Duty and Registration Fees,['Business & Entrepreneurship']
Aatmanirbhar Gujarat Scheme for assistance to Large Industries and Thrust Sector: Assistance of Interest Subsidy,['Business & Entrepreneurship']
Aatmanirbhar Gujarat Scheme for assistance to Large Industries and Thrust Sector: EPF Reimbursement,['Business & Entrepreneurship']
Aatmanirbhar Gujarat Scheme for assistance to Large Industries and Thrust Sector: Net SGST Reimbursement,['Business & Entrepreneurship']
"Aatmanirbhar Gujarat Scheme for assistance to MSMEs: Assistance for Interest Subsidy to Micro, Small and Medium Enterprise (Manufacturing Sector)",['Business & Entrepreneurship']
"Aatmanirbhar Gujarat Scheme for assistance to MSMEs: Assistance for Interest Subsidy to Micro, Small and Medium Enterprise (Service Sector)",['Business & Entrepreneurship']
Aatmanirbhar Gujarat Scheme for assistance to MSMEs: Assistance for Patent Registration,['Business & Entrepreneurship']
Aatmanirbhar Gujarat Scheme for assistance to MSMEs: Assistance for Power Connection Charges,['Business & Entrepreneurship']
Aatmanirbhar Gujarat Scheme for assistance to MSMEs: Assistance for Quality Certification,['Business & Entrepreneurship']
Aatmanirbhar Gujarat Scheme for assistance to MSMEs: Assistance for Raising Capital through SME Exchange,['Business & Entrepreneurship']
Aatmanirbhar Gujarat Scheme for assistance to MSMEs: Assistance for Reimbursement of CGTMSE Fees,['Business & Entrepreneurship']
Aatmanirbhar Gujarat Scheme for assistance to MSMEs: Assistance for Saving in Consumption of Energy and Water,['Business & Entrepreneurship']
Aatmanirbhar Gujarat Scheme for assistance to MSMEs: Assistance for Technology Acquisition,['Business & Entrepreneurship']
Aatmanirbhar Gujarat Scheme for assistance to MSMEs: Assistance in Implementation of Information and Communication Technology,['Business & Entrepreneurship']
Aatmanirbhar Gujarat Scheme for assistance to MSMEs: Assistance in Rent to MSEs,['Business & Entrepreneurship']
Aatmanirbhar Gujarat Scheme for assistance to MSMEs: Assistance of Capital Investment Subsidy to Micro enterprises,['Business & Entrepreneurship']
Aatmanirbhar Gujarat Scheme for assistance to MSMEs: EPF Reimbursement to MSMEs,['Business & Entrepreneurship']
Aatmanirbhar Gujarat Scheme for assistance to MSMEs: Financial Support to MSMEs in ZED Certification,['Business & Entrepreneurship']
"Aatmanirbhar Gujarat Scheme for assistance to MSMEs: Net SGST reimbursement to Micro, Small and Medium Manufacturing Enterprise (MSMEs):",['Business & Entrepreneurship']
Aatmanirbhar Gujarat Scheme for assistance to MSMEs: Rehabilitation of Sick Enterprise,['Business & Entrepreneurship']
Aawaas Sahayata,['Education & Learning']
Aaws Bhatta Sahayata Yojana,['Education & Learning']
Abdul Kalam Technology Innovation National Fellowship,['Education & Learning']
Abhinandan Education Loan Subsidy Scheme,['Education & Learning']
Academic Education (JKBOCWWB),['Education & Learning']
Access To Knowledge For Technology Development And Dissemination (A2K+) - Studies,['Education & Learning']
Additional Financial Assistance for the Children of Persons Engaged in the Cleaning Profession,['Education & Learning']
Adi Dravidar and Tribal Welfare Department-Hostels: Special Guides,['Education & Learning']
Adi Dravidar and Tribal Welfare Department-Incentive/Award of Prizes,['Education & Learning']
Adi Dravidar and Tribal Welfare Department: Incentive/Award of Prizes-For Each Subjects,['Education & Learning']
Adi Dravidar and Tribal Welfare Department: Scholarship-Free Education upto 12th Std. to All,['Education & Learning']
Adi Dravidar and Tribal Welfare Department: Scholarship-Public Examination Fee for 10th and 12th Std.,['Education & Learning']
Adi Dravidar and Tribal Welfare Department: Stationary-Text Books,['Education & Learning']
Admission in Post Matric Hostel,['Education & Learning']
Admission of Adi Dravidar/Tribal Students in Plus One at Reputed Schools,['Education & Learning']
Advance Authorisation(AA),['Education & Learning']
Agnipath Yojana,['Education & Learning']
Agri-Clinics And Agri-Business Centres Scheme,['Education & Learning']
Agricultural Extension,['Education & Learning']
Agricultural Skill Development Training Programme For Women Farmers And Farmers,['Skills & Employment']
Agriculture Academic Studies Scheme,['Education & Learning']
Agriculture And Processed Foods Export Promotion Scheme Of APEDA For The 15th Finance Commission Cycle (2021-22 To 2025-26),['Business & Entrepreneurship']
Airavata Scheme,['Skills & Employment']
Akanksha Scheme,['Education & Learning']
AlCTE - Distinguished Professional Scheme,['Education & Learning']
Allowance for 100% Blind,['Education & Learning']
Alpasankhyak Post-Maitrik Chhaatravrtti Yojana,['Education & Learning']
Alpsankhyak Merit-Cum-Means Chatravriti Yojana,['Education & Learning']
Ambedkar DBT Voucher Scheme,['Education & Learning']
Ambedkar Fellowship Scheme,['Education & Learning']
Amended Technology Upgradation Fund,['Business & Entrepreneurship']
Annai Teresa Ninaivu Marriage Assistance Scheme for Orphan Girls-II,['Education & Learning']
Annal Ambedkar Business Champions Scheme,['Business & Entrepreneurship']
Annal Gandhi Memorial Award,['Education & Learning']
Arivu Education Loan Scheme,['Education & Learning']
Artificial Limbs/Assistive Equipments Scheme,['Education & Learning']
Artisan Promotion,['Business & Entrepreneurship']
Arunachal Pradesh Entrepreneurship Challenge,['Business & Entrepreneurship']
Arundhati Gold Scheme,['Education & Learning']
Asangathit Karmakar Ke Bachcho Hetu Chhatravriti Yojana,['Education & Learning']
Asangathita Shramik Sahayika Prakalpa,['Skills & Employment']
Ashadeepa Scheme,['Skills & Employment']
Ashram Schools (Scheduled Tribes),['Education & Learning']
Assam Abhinandan Education Loan Subsidy Scheme,['Education & Learning']
Assistance Scheme for Handicraft Artisans,['Business & Entrepreneurship']
Assistance Towards Expenses Incurred for Raising of Funds through NSE’s/ BSE’s SME Exchange Platform,['Business & Entrepreneurship']
Assistance for Digitization of Business Processes and Adoption of eCommerce,['Education & Learning']
Assistance for Quality Enhancement,['Business & Entrepreneurship']
Assistance to Persons with Disabilities for Purchase/Fitting of Artificial Limbs/Appliances,['Skills & Employment']
Assistance to Training Institutions Scheme,['Education & Learning']
Assistance to Voluntary Organizations Working for Welfare of OBCs,['Skills & Employment']
Aswachh Dhandha Chhaatravrtti,['Education & Learning']
Atal Awasiya Vidyala Yojana,['Education & Learning']
Atal Mission For Rejuvenation And Urban Transformation,['Education & Learning']
Atal Sneh Yojana,['Education & Learning']
Attendance Scholarship Scheme for Girl Students with Disabilities of Rural Areas,['Education & Learning']
Award For Meritorious Students Of Meghalaya In The HSSLC Examination (Science Stream),['Education & Learning']
Award Of Scholarships To Young Artists In Different Cultural Fields,['Education & Learning']
Award Of Stipend To VJNT And SBC Students Studying In ITI,['Education & Learning']
"Award for Success in State Public Service Commission, Union Public Service Commission Examination (MPBOCWWB)",['Education & Learning']
Award of Adhoc Merit Grant (Special Incentive) to Scheduled Caste Students,['Education & Learning']
Award of Attendance Scholarship to Girl Students in the Middle Stage of Education,['Education & Learning']
Award of Opportunity Cost to Parents of Scheduled Caste Girl Students,['Education & Learning']
Award of Post-Matric Scholarship to Scheduled Caste Students,['Education & Learning']
Award of Pre-Matric Scholarship to Other Economically Backward Class (OEBC) Students,['Education & Learning']
Award of Pre-matric Scholarship to Scheduled Caste Students Studying from VI to X Standard in Government Schools and Government recognised Private Schools in the Union Territory of Puducherry,['Education & Learning']
Award of Pre-matric Scholarship to the Students Whose Parents Are Engaged in Unclean Occupation,['Education & Learning']
Award of Puducherry State Post-Matric Scholarship Scheme,['Education & Learning']
Award of Scholarship to Differently Abled Person Students,['Education & Learning']
"Award of Scholarship to the Cadets Belonging to UT of Puducherry and Studying in Rashtriya Indian Military College, Dehradun",['Education & Learning']
Award of Scholarship to the Children who are Recipients of National Child Award for Exceptional Achievements and Other National / International Merit Awards,['Education & Learning']
Award of Scholarships to Outstanding NCC Cadets of the UT of Puducherry,['Education & Learning']
Award to Scheduled Castes Students Who Secured Top Ranks at State and District Level in Standard X & XII (Sahuji Maharaj Assistance),['Education & Learning']
Awards to Bright Students,['Education & Learning']
Awasiya Vidyala Yojana,['Education & Learning']
BC & EBC Girls Residential +2 High School,['Education & Learning']
BPL (Below Poverty Line) Student Welfare Scholarship - Technical Education,['Education & Learning']
BPL Scholarship for College Students,['Education & Learning']
BSR Scheme,['Education & Learning']
Back Ended Interest Subsidy (BEIS),['Business & Entrepreneurship']
Back-To-Lab Post-Doctoral Fellowship Programme,['Education & Learning']
Back-to-Lab Research Fellowship Programme,['Education & Learning']
Backward Class Students Meritorious Award Scheme,['Education & Learning']
Backward Classes Foreign Study Scholarship Scheme,['Education & Learning']
Bakri Palan Yojana,['Skills & Employment']
Bal Ashrams,['Education & Learning']
"Banglashree for Micro, Small and Medium Enterprises: Interest Subsidy on Term Loan (IS)",['Business & Entrepreneurship']
"Banglashree for Micro, Small and Medium Enterprises: Power Subsidy (PS)",['Business & Entrepreneurship']
"Banglashree for Micro, Small and Medium Enterprises: State Capital Investment Subsidy (CIS)",['Business & Entrepreneurship']
"Banglashree for Micro, Small and Medium Enterprises: Subsidy for Energy Efficiency (EES)",['Business & Entrepreneurship']
"Banglashree for Micro, Small and Medium Enterprises: Subsidy for Patent Registration (PRS)",['Business & Entrepreneurship']
"Banglashree for Micro, Small and Medium Enterprises: Subsidy for Standard Quality Compliance (SCCS)",['Business & Entrepreneurship']
"Banglashree for Micro, Small and Medium Enterprises: Subsidy for State Goods and Services Tax (SGST)",['Business & Entrepreneurship']
"Banglashree for Micro, Small and Medium Enterprises: Subsidy for Water Conservation/Environment Compliance (WCS)",['Business & Entrepreneurship']
"Banglashree for Micro, Small and Medium Enterprises: Subsidy for Work Force Welfare Assistance (WWAS)",['Business & Entrepreneurship']
"Banglashree for Micro, Small and Medium Enterprises: Subsidy on Stamp Duty and Registration Fee (SDRFS)",['Business & Entrepreneurship']
Banishree Scholarship,['Education & Learning']
Bank Guarantee Charges Reimbursement Scheme,['Business & Entrepreneurship']
Bank Loan Processing Fee Reimbursement Scheme,['Education & Learning']
Barbershop Renovation Grant,['Skills & Employment']
Basic Agriculture Training Centre Scheme,['Skills & Employment']
Bebe Nanki Laadli Beti Kalyan Scheme,['Education & Learning']
Behind the Ear Hearing Aids by Welfare of Differently Abled Persons,['Education & Learning']
Berojgari Bhatta Yojna,['Skills & Employment']
Beti Hai Anmol Yojana,['Education & Learning']
Bhagwan Budhdh Scholarship,['Education & Learning']
Bhagyalaxmi Scheme,['Education & Learning']
Bharati Scheme for Education - 1st Class to 5th Class,['Education & Learning']
Bharati Scheme for Education - 6th Class to 10th Class,['Education & Learning']
Bharati Scheme for Education - Graduation,['Education & Learning']
Bharati Scheme for Education - Intermediate or Equivalent,['Education & Learning']
Bharati Scheme for Education - Post-Graduation,['Education & Learning']
Bharati Scheme for Education - Professional Education Course,['Education & Learning']
Bharati Scheme for Education Professional Education Course - Chartered Accountancy Final,['Education & Learning']
Bharati Scheme for Education Professional Education Course - Chartered Accountancy Intern,['Education & Learning']
Bharati Scheme for Master’s Degree Overseas,['Education & Learning']
Bhargava Matching Scheme,['Education & Learning']
Bhed Palan Yojana,['Skills & Employment']
Bhima Bhoi Bhinnakshyama Samarthya Abhiyan,['Education & Learning']
Bhraman - Darshan Yojana,['Education & Learning']
Bicycle Distribution Scheme for Girl Students of Economically Weaker Section,['Education & Learning']
Bidya Lakshmi Loan,['Education & Learning']
Bihar State Alpsankhyak Awasiya Vidyalaya Yojana,['Education & Learning']
Bihar State Journalist Insurance Scheme,['Education & Learning']
Bihar State Madarsa Strengthening Scheme,['Education & Learning']
Bihar Student Credit Card Scheme,['Education & Learning']
Biju Patnaik Sports Award for Best Contribution to promotion of Sports and Games,['Sports']
Biju Patnaik Sports Award for Excellence in Coaching,['Sports']
Biju Patnaik Sports Award for Excellence in Sports Journalism,['Sports']
Biju Patnaik Sports Award for Lifetime Achievement in Promotion of Sports & Games,['Sports']
Biju Patnaik Sports Award for Outstanding Performance in Sports and Games for the Year,['Sports']
Biju Pucca Ghar Yojana,['Education & Learning']
Biju Swasthya Kalyan Yojana,['Education & Learning']
Biju Yuva Sashaktikaran Yojana,['Education & Learning']
Bina Mulya Samajik Suraksha Yojana,['Education & Learning']
Biotechnology Career Advancement And Re-orientation (BioCARe) Programme For Women Scientists,['Education & Learning']
Biotechnology Ignition Grant Scheme,['Education & Learning']
Biotechnology Post-Doctoral Fellowship,['Education & Learning']
Biotechnology Young Entrepreneur Award,['Education & Learning']
Biponi Scheme,['Education & Learning']
Block Level Institute for Rural Skill Acquisition (BIRSA),['Skills & Employment']
Boarding House Stipend Scheme (Tripura Govt.),['Education & Learning']
Boneej Scheme,['Education & Learning']
Book Allowance to the Wards of Ex-Servicemen/Widows (Sainik Welfare),['Education & Learning']
Book Bank Scheme: I,['Education & Learning']
Book Bank Scheme: II,['Education & Learning']
Book Binder Training by Department for the Welfare of Differently Abled Persons,['Education & Learning']
Border Areas Development Department,['Education & Learning']
Border Areas Scholarship,['Education & Learning']
Building And Other Construction Scholarship,['Education & Learning']
Bunkar Parivar Ke Pratibhavan Chatra-Chatraon Ko Protsahan Puraskar Yojana,['Education & Learning']
CBSE Merit Scholarship Scheme For Single Girl Child,['Education & Learning']
CHIEF MINISTER  EMPLOYMENT GENERATION  PROGRAMME (CMEGP),['Skills & Employment']
CIFE - Institutional Fellowship,['Education & Learning']
CM Anuprati Coaching Scheme,['Education & Learning']
CM’s Lairik Heiminnashi Programme (CMLH): Pre-Matric Remedial Coaching,['Education & Learning']
Campus Recruitment Assistance Scheme,['Education & Learning']
Cancer Suraksha Scheme,['Education & Learning']
Capacity Building For Service Providers - Entrepreneurship Programme,['Skills & Employment']
Capacity Building For Service Providers - Skill Testing & Certification,['Education & Learning']
Capital Contribution Scheme (Goa),['Business & Entrepreneurship']
Capital Investment Subsidy Scheme,['Business & Entrepreneurship']
Capital Investment Subsidy Scheme for Goan Diaspora,['Business & Entrepreneurship']
"Capital Investment Subsidy: Thrust Area Industries"" under ""Motivation of Entrepreneurs to Start Industries and Fiscal Assistance to Industries""",['Business & Entrepreneurship']
Capital Subsidy,['Business & Entrepreneurship']
Cash Award (A.B.O.C.W.W.B),['Education & Learning']
Cash Award (MBOCWWB),['Education & Learning']
Cash Award to Top Ranking Holders in Public Examinations,['Education & Learning']
Cash Award to the Meritorious Visually Impaired Students Obtaining First Three Ranks at the State Level in the SSLC and HSC Examination,['Education & Learning']
Cash Benefit Scheme Scheme (PBAOCWWB),['Education & Learning']
Cash Incentive to Wards of ESM (Academic Scholarship),['Education & Learning']
Cash Prizes Scheme (BBOCWWB),['Education & Learning']
Central Sector Scheme for Rehabilitation of Bonded Labourer,['Skills & Employment']
